ltable_title,rtable_title,ltable_authors,rtable_authors,ltable_keywords,rtable_keywords,_id
"don't give me the details, just the summary! topic-aware convolutional neural networks for extreme summarization",stm: an r package for structural topic models,s narayan; sb cohen; m lapata,me roberts; bm stewart; d tingley,"Topic-Aware Convolutional Neural Networks, Extreme Summarization","Structural Topic Model, Topic Modeling, Text Classifications",550
"read, watch, listen, and summarize: multi-modal summarization for asynchronous text, image, audio and video",short-text topic modeling via non-negative matrix factorization enriched with local word-context correlations,h li; j zhu; c ma; j zhang,t shi; k kang; j choo; ck reddy,"Summarization, Multimedia, Multi-modal, Cross-modal, Natural language processing, Computer vision","Topic modeling, short texts, non-negative matrix factorization, word embedding",928
diachronic word embeddings and semantic shifts: a survey,facebook language predicts depression in medical records,a kutuzov; l øvrelid; t szymanski; e velldal,jc eichstaedt; rj smith,"Word Embedding, Semantic Shift, Topic Modelling ","big data, depression, social media, Facebook, screening",488
the utility of topic modelling for discourse studies: a critical evaluation,what do hotel customers complain about? text analysis using structural topic model,g brookes; t mcenery,n hu; t zhang; b gao; i bose,"Corpus linguistics, corpus-assisted discourse studies, latent Dirichlet allocation, patient feedback, topic modelling",Online hotel reviews Customer dissatisfaction Structural topic model Text mining Tripadviso,1170
applying lda topic modeling in communication research: toward a valid and reliable methodology,"deep learning: a comprehensive overview on techniques, taxonomy, applications and research directions",d maier; a waldherr; p miltner,ih sarker,"Content analysis, Communication research methods, Validity, Reliability, Textual analysis","Deep learning, Artifcial neural network, Artifcial intelligence, Discriminative learning, Generative learning, Hybrid learning, Intelligent systems",146
"deep learning: a comprehensive overview on techniques, taxonomy, applications and research directions",policy diffusion: the issue‐definition stage,ih sarker,f gilardi; cr shipan; b wüest,"Deep learning, Artifcial neural network, Artifcial intelligence, Discriminative learning, Generative learning, Hybrid learning, Intelligent systems","Policy Diffusion, Topic Modeling, Definion Stage",402
"real-time crash prediction models: state-of-the-art, design pathways and ubiquitous requirements",what is wrong with topic modeling? and how to fix it using search-based software engineering,m hossain; m abdel-aty; ma quddus,a agrawal; w fu; t menzies,ITS Real-time crash prediction model Design pathway Universal design requirements,"Topic modeling, Stability, LDA, tuning, differential evolution",954
the effect of online reviews on product sales: a joint sentiment-topic analysis,cistopic: cis-regulatory topic modeling on single-cell atac-seq data,x li; c wu; f mai,c bravo gonzález-blas; l minnoye; d papasokrati,"eWOM, electronic word-of-mouth, star rating, textual sentiment, topical sentiment, product reviews, sales, joint sentiment-topic analysis, JST, mediation analysis","cis-Regulator, topic modeling",1148
health communication through news media during the early stage of the covid-19 outbreak in china: digital topic modeling approach,policy diffusion: the issue‐definition stage,q liu; z zheng; j zheng; q chen; g liu; s chen,f gilardi; cr shipan; b wüest,coronavirus (150); COVID-19 (933); outbreak (47); health communication (36); mass media (4); public crisis (1); topic modeling (21) ,"Policy Diffusion, Topic Modeling, Definion Stage",659
detecting latent topics and trends in educational technologies over four decades using structural topic modeling: a retrospective of all volumes of computers …,textured interfaces in monolithic perovskite/silicon tandem solar cells: advanced light management for improved efficiency and energy yield,x chen; d zou; g cheng; h xie,m jošt; e köhnen; ab morales-vilches,Applications in subject areas Data science applications in education,"textured interfaces, solar cells, advance light management",463
applying lda topic modeling in communication research: toward a valid and reliable methodology,top concerns of tweeters during the covid-19 pandemic: infoveillance study,d maier; a waldherr; p miltner,a abd-alrazaq; d alhuwail; m househ; m hamdi,"Content analysis, Communication research methods, Validity, Reliability, Textual analysis","coronavirus, COVID-19; SARS-CoV-2 (144); 2019-nCov (8); social media (329); public health (216); Twitter (67); infoveillance (78); infodemiology (134); health informatics (20); disease surveillance (7) ",186
framing covid-19: how we conceptualize and discuss the pandemic on twitter,the effect of online reviews on product sales: a joint sentiment-topic analysis,p wicke; mm bolognesi,x li; c wu; f mai,"Coronavirus, COVID-19, Natural Language Processing, Topic modeling, Deep Learning","eWOM, electronic word-of-mouth, star rating, textual sentiment, topical sentiment, product reviews, sales, joint sentiment-topic analysis, JST, mediation analysis",608
applications of deep learning in stock market prediction: recent progress,"sharp nearby, fuzzy far away: how neural language models use context",w jiang,u khandelwal; h he; p qi; d jurafsky,Stock market prediction Deep learning Machine learning Feedforward neural network Convolutional neural network Recurrent neural network ,"Fuzzy, Topic Modelling, Neutral Language Model",143
leveraging deep learning with lda-based text analytics to detect automobile insurance fraud,top concerns of tweeters during the covid-19 pandemic: infoveillance study,y wang; w xu,a abd-alrazaq; d alhuwail; m househ; m hamdi,"Insurance Fraud, Fraud Detection, Text Analytics, Topic Modeling, Deep Learning","coronavirus, COVID-19; SARS-CoV-2 (144); 2019-nCov (8); social media (329); public health (216); Twitter (67); infoveillance (78); infodemiology (134); health informatics (20); disease surveillance (7) ",751
research trends on big data in marketing: a text mining and topic modeling based literature analysis,the utility of topic modelling for discourse studies: a critical evaluation,a amado; p cortez; p rita; s moro,g brookes; t mcenery,Big data Marketing Literature analysis Research trends Text mining,"Corpus linguistics, corpus-assisted discourse studies, latent Dirichlet allocation, patient feedback, topic modelling",981
aspect-aware latent factor model: rating prediction with ratings and reviews,"multi-co-training for document classification using various document representations: tf–idf, lda, and doc2vec",z cheng; y ding; l zhu; m kankanhalli,d kim; d seo; s cho; p kang,"Aspect-aware, Matrix Factorization, Recommendation, Review-aware, Topic Model","Document classification, Semi-Supervised Learning, TF–IDF, LDA, Doc2Vec, Co-Training",197
policy diffusion: the issue‐definition stage,topic modeling in management research: rendering new theory from textual data,f gilardi; cr shipan; b wüest,tr hannigan; rfj haans; k vakili,"Policy Diffusion, Topic Modeling, Definion Stage","topic modeling, management theory, rendering, text analysis, big data, theory building, qualitative analysis, mixed methods",883
"benchmarking zero-shot text classification: datasets, evaluation and entailment approach","social media analytics–challenges in topic discovery, data collection, and data preparation",w yin; j hay; d roth,s stieglitz; m mirbabaie; b ross,"Classification, Topic Modelling, Zero-shot text",Social media analytics Social media Information systems Big data,279
"benchmarking zero-shot text classification: datasets, evaluation and entailment approach",toward understanding the topical structure of hospitality literature: applying machine learning and traditional statistics,w yin; j hay; d roth,e park; b chae; j kwon,"Classification, Topic Modelling, Zero-shot text","topical structure modeling, topic modeling",293
text mining in organizational research,"trends and trajectories for explainable, accountable and intelligible systems: an hci research agenda",vb kobayashi; st mol; ha berkers,a abdul; j vermeulen; d wang; by lim,"text mining, dimensionality reduction, clustering, topic modeling, classification, validation, job analysis",Intelligibility; explanations; explainable artificial intelligence; interpretable machine learning.,1112
"deep learning: a comprehensive overview on techniques, taxonomy, applications and research directions",topic compositional neural language model,ih sarker,w wang; z gan; w wang; d shen,"Deep learning, Artifcial neural network, Artifcial intelligence, Discriminative learning, Generative learning, Hybrid learning, Intelligent systems","Neural Language Model, Topic Compositional, Topic Modeling",400
applications of deep learning in stock market prediction: recent progress,"multi-co-training for document classification using various document representations: tf–idf, lda, and doc2vec",w jiang,d kim; d seo; s cho; p kang,Stock market prediction Deep learning Machine learning Feedforward neural network Convolutional neural network Recurrent neural network ,"Document classification, Semi-Supervised Learning, TF–IDF, LDA, Doc2Vec, Co-Training",122
aspect-aware latent factor model: rating prediction with ratings and reviews,topic modeling in management research: rendering new theory from textual data,z cheng; y ding; l zhu; m kankanhalli,tr hannigan; rfj haans; k vakili,"Aspect-aware, Matrix Factorization, Recommendation, Review-aware, Topic Model","topic modeling, management theory, rendering, text analysis, big data, theory building, qualitative analysis, mixed methods",202
"network-oriented modeling for adaptive networks: designing higher-order adaptive biological, mental and social network models","the mythos of model interpretability: in machine learning, the concept of interpretability is both important and slippery.",j treur,zc lipton,"Topic modeling, Network-Oriented Modeling, Adaptive Network","Machine larning, Model Interpretability",835
automated phrase mining from massive text corpora,cistopic: cis-regulatory topic modeling on single-cell atac-seq data,j shang; j liu; m jiang; x ren,c bravo gonzález-blas; l minnoye; d papasokrati,"Automatic phrase mining, phrase mining, distant training, part-of-speech tag, multiple languages","cis-Regulator, topic modeling",246
"the mythos of model interpretability: in machine learning, the concept of interpretability is both important and slippery.",top concerns of tweeters during the covid-19 pandemic: infoveillance study,zc lipton,a abd-alrazaq; d alhuwail; m househ; m hamdi,"Machine larning, Model Interpretability","coronavirus, COVID-19; SARS-CoV-2 (144); 2019-nCov (8); social media (329); public health (216); Twitter (67); infoveillance (78); infodemiology (134); health informatics (20); disease surveillance (7) ",1163
"deep learning: a comprehensive overview on techniques, taxonomy, applications and research directions","network-oriented modeling for adaptive networks: designing higher-order adaptive biological, mental and social network models",ih sarker,j treur,"Deep learning, Artifcial neural network, Artifcial intelligence, Discriminative learning, Generative learning, Hybrid learning, Intelligent systems","Topic modeling, Network-Oriented Modeling, Adaptive Network",384
no longer lost in translation: evidence that google translate works for comparative bag-of-words text applications,"trends and trajectories for explainable, accountable and intelligible systems: an hci research agenda",e de vries; m schoonvelde; g schumacher,a abdul; j vermeulen; d wang; by lim,"automated content analysis, statistical analysis of texts, bag-of-words models, Google Translate, LDA",Intelligibility; explanations; explainable artificial intelligence; interpretable machine learning.,854
aspect-aware latent factor model: rating prediction with ratings and reviews,"don't give me the details, just the summary! topic-aware convolutional neural networks for extreme summarization",z cheng; y ding; l zhu; m kankanhalli,s narayan; sb cohen; m lapata,"Aspect-aware, Matrix Factorization, Recommendation, Review-aware, Topic Model","Topic-Aware Convolutional Neural Networks, Extreme Summarization",219
health communication through news media during the early stage of the covid-19 outbreak in china: digital topic modeling approach,"network-oriented modeling for adaptive networks: designing higher-order adaptive biological, mental and social network models",q liu; z zheng; j zheng; q chen; g liu; s chen,j treur,coronavirus (150); COVID-19 (933); outbreak (47); health communication (36); mass media (4); public crisis (1); topic modeling (21) ,"Topic modeling, Network-Oriented Modeling, Adaptive Network",641
academic influence aware and multidimensional network analysis for research collaboration navigation based on scholarly big data,"social media analytics–challenges in topic discovery, data collection, and data preparation",x zhou; w liang; i kevin; k wang,s stieglitz; m mirbabaie; b ross,"Multidimensional network analysis, academic influence, scholarly big data, scholarly recommendation, research collaboration",Social media analytics Social media Information systems Big data,1
applications of deep learning in stock market prediction: recent progress,public perception of the covid-19 pandemic on twitter: sentiment analysis and topic modeling study,w jiang,s boon-itt; y skunkan,Stock market prediction Deep learning Machine learning Feedforward neural network Convolutional neural network Recurrent neural network ,COVID-19; Twitter; social media; infoveillance; infodemiology; infodemic; data; health informatics; mining; perception; topic modeling,112
"latent dirichlet allocation (lda) and topic modeling: models, applications, a survey",research trends on big data in marketing: a text mining and topic modeling based literature analysis,h jelodar; y wang; c yuan; x feng; x jiang,a amado; p cortez; p rita; s moro,"Topic modeling, Latent Dirichlet allocation, Tag recommendation, Semantic web, Gibbs sampling",Big data Marketing Literature analysis Research trends Text mining,698
"real-time crash prediction models: state-of-the-art, design pathways and ubiquitous requirements",text similarity in vector space models: a comparative study,m hossain; m abdel-aty; ma quddus,o shahmirzadi; a lugowski,ITS Real-time crash prediction model Design pathway Universal design requirements,"text similarity, vector space model, text embedding, patent, big data",951
stock movement prediction from tweets and historical prices,toward understanding the topical structure of hospitality literature: applying machine learning and traditional statistics,y xu; sb cohen,e park; b chae; j kwon,"Twitter, Stock Price, Topic Modelling","topical structure modeling, topic modeling",1102
deep sentiment classification and topic discovery on novel coronavirus or covid-19 online discussions: nlp using lstm recurrent neural network approach,topic compositional neural language model,h jelodar; y wang; r orji,w wang; z gan; w wang; d shen,"Coronavirus, COVID-19, Natural Language Processing, Topic modeling, Deep Learning","Neural Language Model, Topic Compositional, Topic Modeling",441
health communication through news media during the early stage of the covid-19 outbreak in china: digital topic modeling approach,mapping the anti-vaccination movement on facebook,q liu; z zheng; j zheng; q chen; g liu; s chen,n smith; t graham,coronavirus (150); COVID-19 (933); outbreak (47); health communication (36); mass media (4); public crisis (1); topic modeling (21) ,Anti-vaccination; social network analysis; topic modelling; social network sites; social media,663
text mining in organizational research,toward understanding the topical structure of hospitality literature: applying machine learning and traditional statistics,vb kobayashi; st mol; ha berkers,e park; b chae; j kwon,"text mining, dimensionality reduction, clustering, topic modeling, classification, validation, job analysis","topical structure modeling, topic modeling",1119
"benchmarking zero-shot text classification: datasets, evaluation and entailment approach",detecting latent topics and trends in educational technologies over four decades using structural topic modeling: a retrospective of all volumes of computers …,w yin; j hay; d roth,x chen; d zou; g cheng; h xie,"Classification, Topic Modelling, Zero-shot text",Applications in subject areas Data science applications in education,317
health communication through news media during the early stage of the covid-19 outbreak in china: digital topic modeling approach,"multi-co-training for document classification using various document representations: tf–idf, lda, and doc2vec",q liu; z zheng; j zheng; q chen; g liu; s chen,d kim; d seo; s cho; p kang,coronavirus (150); COVID-19 (933); outbreak (47); health communication (36); mass media (4); public crisis (1); topic modeling (21) ,"Document classification, Semi-Supervised Learning, TF–IDF, LDA, Doc2Vec, Co-Training",648
"latent dirichlet allocation (lda) and topic modeling: models, applications, a survey","the mythos of model interpretability: in machine learning, the concept of interpretability is both important and slippery.",h jelodar; y wang; c yuan; x feng; x jiang,zc lipton,"Topic modeling, Latent Dirichlet allocation, Tag recommendation, Semantic web, Gibbs sampling","Machine larning, Model Interpretability",709
research trends on big data in marketing: a text mining and topic modeling based literature analysis,social media mining for product planning: a product opportunity mining approach based on topic modeling and sentiment analysis,a amado; p cortez; p rita; s moro,b jeong; j yoon; jm lee,Big data Marketing Literature analysis Research trends Text mining,Product opportunity New product development Social media mining Opportunity algorithm Topic modeling Sentiment analysis,972
framing covid-19: how we conceptualize and discuss the pandemic on twitter,stm: an r package for structural topic models,p wicke; mm bolognesi,me roberts; bm stewart; d tingley,"Coronavirus, COVID-19, Natural Language Processing, Topic modeling, Deep Learning","Structural Topic Model, Topic Modeling, Text Classifications",627
health communication through news media during the early stage of the covid-19 outbreak in china: digital topic modeling approach,the utility of topic modelling for discourse studies: a critical evaluation,q liu; z zheng; j zheng; q chen; g liu; s chen,g brookes; t mcenery,coronavirus (150); COVID-19 (933); outbreak (47); health communication (36); mass media (4); public crisis (1); topic modeling (21) ,"Corpus linguistics, corpus-assisted discourse studies, latent Dirichlet allocation, patient feedback, topic modelling",632
topic compositional neural language model,toward understanding the topical structure of hospitality literature: applying machine learning and traditional statistics,w wang; z gan; w wang; d shen,e park; b chae; j kwon,"Neural Language Model, Topic Compositional, Topic Modeling","topical structure modeling, topic modeling",1195
what do hotel customers complain about? text analysis using structural topic model,what is wrong with topic modeling? and how to fix it using search-based software engineering,n hu; t zhang; b gao; i bose,a agrawal; w fu; t menzies,Online hotel reviews Customer dissatisfaction Structural topic model Text mining Tripadviso,"Topic modeling, Stability, LDA, tuning, differential evolution",1222
"multi-co-training for document classification using various document representations: tf–idf, lda, and doc2vec",the utility of topic modelling for discourse studies: a critical evaluation,d kim; d seo; s cho; p kang,g brookes; t mcenery,"Document classification, Semi-Supervised Learning, TF–IDF, LDA, Doc2Vec, Co-Training","Corpus linguistics, corpus-assisted discourse studies, latent Dirichlet allocation, patient feedback, topic modelling",795
health communication through news media during the early stage of the covid-19 outbreak in china: digital topic modeling approach,the effect of online reviews on product sales: a joint sentiment-topic analysis,q liu; z zheng; j zheng; q chen; g liu; s chen,x li; c wu; f mai,coronavirus (150); COVID-19 (933); outbreak (47); health communication (36); mass media (4); public crisis (1); topic modeling (21) ,"eWOM, electronic word-of-mouth, star rating, textual sentiment, topical sentiment, product reviews, sales, joint sentiment-topic analysis, JST, mediation analysis",645
"sharp nearby, fuzzy far away: how neural language models use context",stock movement prediction from tweets and historical prices,u khandelwal; h he; p qi; d jurafsky,y xu; sb cohen,"Fuzzy, Topic Modelling, Neutral Language Model","Twitter, Stock Price, Topic Modelling",1012
"don't give me the details, just the summary! topic-aware convolutional neural networks for extreme summarization",text mining in organizational research,s narayan; sb cohen; m lapata,vb kobayashi; st mol; ha berkers,"Topic-Aware Convolutional Neural Networks, Extreme Summarization","text mining, dimensionality reduction, clustering, topic modeling, classification, validation, job analysis",556
heterogeneous graph attention networks for semi-supervised short text classification,stock movement prediction from tweets and historical prices,h linmei; t yang; c shi; h ji; x li,y xu; sb cohen,"Heterogeneous Graph Attention Networks, Semi-supervised Short Text Classification","Twitter, Stock Price, Topic Modelling",681
facebook language predicts depression in medical records,"latent dirichlet allocation (lda) and topic modeling: models, applications, a survey",jc eichstaedt; rj smith,h jelodar; y wang; c yuan; x feng; x jiang,"big data, depression, social media, Facebook, screening","Topic modeling, Latent Dirichlet allocation, Tag recommendation, Semantic web, Gibbs sampling",577
"don't give me the details, just the summary! topic-aware convolutional neural networks for extreme summarization",health communication through news media during the early stage of the covid-19 outbreak in china: digital topic modeling approach,s narayan; sb cohen; m lapata,q liu; z zheng; j zheng; q chen; g liu; s chen,"Topic-Aware Convolutional Neural Networks, Extreme Summarization",coronavirus (150); COVID-19 (933); outbreak (47); health communication (36); mass media (4); public crisis (1); topic modeling (21) ,524
social media mining for product planning: a product opportunity mining approach based on topic modeling and sentiment analysis,what do hotel customers complain about? text analysis using structural topic model,b jeong; j yoon; jm lee,n hu; t zhang; b gao; i bose,Product opportunity New product development Social media mining Opportunity algorithm Topic modeling Sentiment analysis,Online hotel reviews Customer dissatisfaction Structural topic model Text mining Tripadviso,1059
"don't give me the details, just the summary! topic-aware convolutional neural networks for extreme summarization","the mythos of model interpretability: in machine learning, the concept of interpretability is both important and slippery.",s narayan; sb cohen; m lapata,zc lipton,"Topic-Aware Convolutional Neural Networks, Extreme Summarization","Machine larning, Model Interpretability",540
leveraging deep learning with lda-based text analytics to detect automobile insurance fraud,stock movement prediction from tweets and historical prices,y wang; w xu,y xu; sb cohen,"Insurance Fraud, Fraud Detection, Text Analytics, Topic Modeling, Deep Learning","Twitter, Stock Price, Topic Modelling",748
text similarity in vector space models: a comparative study,toward understanding the topical structure of hospitality literature: applying machine learning and traditional statistics,o shahmirzadi; a lugowski,e park; b chae; j kwon,"text similarity, vector space model, text embedding, patent, big data","topical structure modeling, topic modeling",1133
diachronic word embeddings and semantic shifts: a survey,"latent dirichlet allocation (lda) and topic modeling: models, applications, a survey",a kutuzov; l øvrelid; t szymanski; e velldal,h jelodar; y wang; c yuan; x feng; x jiang,"Word Embedding, Semantic Shift, Topic Modelling ","Topic modeling, Latent Dirichlet allocation, Tag recommendation, Semantic web, Gibbs sampling",484
analyst information discovery and interpretation roles: a topic modeling approach,facebook language predicts depression in medical records,ah huang; r lehavy; ay zang,jc eichstaedt; rj smith,"analysts, discovery, interpretation, topic modeling, latent Dirichlet allocation","big data, depression, social media, Facebook, screening",95
short-text topic modeling via non-negative matrix factorization enriched with local word-context correlations,"social media analytics–challenges in topic discovery, data collection, and data preparation",t shi; k kang; j choo; ck reddy,s stieglitz; m mirbabaie; b ross,"Topic modeling, short texts, non-negative matrix factorization, word embedding",Social media analytics Social media Information systems Big data,1020
facebook language predicts depression in medical records,"sharp nearby, fuzzy far away: how neural language models use context",jc eichstaedt; rj smith,u khandelwal; h he; p qi; d jurafsky,"big data, depression, social media, Facebook, screening","Fuzzy, Topic Modelling, Neutral Language Model",563
